Título,Link,Data,Hora
"Consulta Pública sobre a nova Instrução Normativa de Dispensa Eletrônica","https://www.gov.br/compras/pt-br/acesso-a-informacao/noticias/consulta-publica-sobre-a-instrucao-normativa-de-dispensa-eletronica ",26/11/2020,13h49
"Consulta Pública nº 07/2020","https://www.gov.br/compras/pt-br/acesso-a-informacao/noticias/consulta-publica-no-07-2020 ",20/11/2020,10h32
"Intenção de Registro de Preços (IRP) nº 26/2020","https://www.gov.br/compras/pt-br/acesso-a-informacao/noticias/intencao-de-registro-de-precos-irp-no-26-2020 ",19/11/2020,14h49
"CONSULTA PÚBLICA Nº 06/2020","https://www.gov.br/compras/pt-br/acesso-a-informacao/noticias/consulta-publica-no-06-2020 ",05/11/2020,16h42
"O atendimento do Siasg evoluiu!","https://www.gov.br/compras/pt-br/acesso-a-informacao/noticias/o-atendimento-do-siasg-evoluiu ",05/11/2020,16h31
"Estados e municípios realizaram mais de 40 mil pregões eletrônicos em um ano","https://www.gov.br/compras/pt-br/acesso-a-informacao/noticias/estados-e-municipios-realizaram-mais-de-40-mil-pregoes-eletronicos-em-um-ano ",28/10/2020,20h29
"Manutenção do Sistema Comprasnet","https://www.gov.br/compras/pt-br/acesso-a-informacao/noticias/manutencao-do-sistema-comprasnet ",16/10/2020,10h35
"Empresas estrangeiras já podem participar das licitações no Comprasnet","https://www.gov.br/compras/pt-br/acesso-a-informacao/noticias/empresas-estrangeiras-ja-podem-participar-das-licitacoes-no-comprasnet ",07/10/2020,10h56
"Compartilhe e pesquise ETP's com outros órgãos","https://www.gov.br/compras/pt-br/acesso-a-informacao/noticias/pesquisa-externa-no-etp-digital ",23/09/2020,12h02
"Atualização do endereço eletrônico do novo Portal de Compras","https://www.gov.br/compras/pt-br/acesso-a-informacao/noticias/atualizacao-do-endereco-eletronico-do-novo-portal-de-compras ",10/09/2020,11h00
"Ministério da Economia realizará licitação do TáxiGov para órgãos e entidades localizados em Rondônia.","https://www.gov.br/compras/pt-br/acesso-a-informacao/noticias/ministerio-da-economia-realizara-licitacao-do-taxigov-para-orgaos-e-entidades-localizados-na-rondonia ",01/09/2020,18h06
"Portal de Compras Governamentais migrou para o Gov.br","https://www.gov.br/compras/pt-br/acesso-a-informacao/noticias/portal-de-compras-governamentais-migrou-para-o-gov.br ",26/08/2020,18h10
"Ministério da Economia publica licitação do TáxiGov para órgãos e entidades localizados na Bahia.","https://www.gov.br/compras/pt-br/acesso-a-informacao/noticias/ministerio-da-economia-publica-licitacao-do-taxigov-para-orgaos-e-entidades-localizados-na-bahia ",26/08/2020,00h00
"Portal de Compras integrará o portal único do Governo Federal (Gov.br)","https://www.gov.br/compras/pt-br/acesso-a-informacao/noticias/portal-de-compras-integrara-o-portal-unico-do-governo-federal-gov-br ",23/08/2020,17h13
"Consulta Pública nº 5/2020 - Ativos de rede","https://www.gov.br/compras/pt-br/acesso-a-informacao/noticias/consulta-publica-no-5-2020-ativos-de-rede ",17/08/2020,00h00
"Atualizações sobre o ETP Digital","https://www.gov.br/compras/pt-br/acesso-a-informacao/noticias/atualizacoes-sobre-o-etp-digital ",13/08/2020,16h56
"Comunicado de Intenção de Registro de Preços (IRP) nº 16/2020","https://www.gov.br/compras/pt-br/acesso-a-informacao/noticias/comunicado-irp-16-de-2020 ",13/08/2020,09h48
"Orientação quanto as contratações de TIC e a utilização do Sistema ETP Digital","https://www.gov.br/compras/pt-br/acesso-a-informacao/noticias/orientacao-quanto-as-contratacoes-de-tic-com-a-utilizacao-do-etp-digital ",07/08/2020,11h47
"Transparência em contratações públicas emergenciais no combate à COVID-19","https://www.gov.br/compras/pt-br/acesso-a-informacao/noticias/transparencia-em-contratacoes-publicas-emergenciais-covid-19 ",31/07/2020,10h51
"Comunicado de Intenção de Registro de Preços (IRP) nº 15/2020","https://www.gov.br/compras/pt-br/acesso-a-informacao/noticias/comunicado-de-intencao-de-registro-de-precos-irp-no-15-2020 ",30/07/2020,00h00
"Resultado do Processo Seletivo SEGES – GSISTE/NS","https://www.gov.br/compras/pt-br/acesso-a-informacao/noticias/resultado-do-processo-seletivo-gsiste-ns ",24/07/2020,18h37
"Fornecedores poderão fazer empréstimos e financiamentos utilizando contratos administrativos","https://www.gov.br/compras/pt-br/acesso-a-informacao/noticias/fornecedores-poderao-fazer-emprestimos-e-financiamentos-utilizando-contratos-administrativos ",09/07/2020,09h46
"Ministério da Economia centralizará a licitação de serviços de apoio administrativo, recepção e secretariado para órgãos e entidades localizados no Distrito Federal","https://www.gov.br/compras/pt-br/acesso-a-informacao/noticias/irp-13-contratacao-de-servicos-de-apoio-administrativo-recepcao-e-secretariado ",08/07/2020,09h30
"Economia torna digital a fase de estudos de licitações públicas","https://www.gov.br/compras/pt-br/acesso-a-informacao/noticias/economia-torna-digital-fase-de-estudos-de-licitacoes-publicas ",03/07/2020,20h00
"Processo Seletivo da SEGES – GSISTE/NS – Inscrições até 10/07","https://www.gov.br/compras/pt-br/acesso-a-informacao/noticias/processo-seletivo-gsiste-ns ",02/07/2020,11h56
"Comunicado importante: utilização do Sistema ETP digital para elaboração dos Estudos Técnicos Preliminares","https://www.gov.br/compras/pt-br/acesso-a-informacao/noticias/elaboracao-de-etp-digital-vigencia ",30/06/2020,08h30
"Prorrogação da Consulta Pública nº 4/2020 - Computação em nuvem","https://www.gov.br/compras/pt-br/acesso-a-informacao/noticias/prorrogacao-cp04-2020-computacao-em-nuvem ",29/06/2020,10h30
"Ministério da Economia realizará licitação do TáxiGov para órgãos e entidades localizados no Rio Grande do Sul","https://www.gov.br/compras/pt-br/acesso-a-informacao/noticias/comunicado-irp-12-de-2020 ",29/06/2020,09h30
"Ministério da Economia realizará licitação do TáxiGov para órgãos e entidades localizados no Rio Grande do Norte","https://www.gov.br/compras/pt-br/acesso-a-informacao/noticias/comunicado-irp-11-de-2020 ",29/06/2020,09h10
"Comunicado de Intenção de Registro de Preços – IRP 09/2020 - TAXIGOV - Salvador","https://www.gov.br/compras/pt-br/acesso-a-informacao/noticias/comunicado-irp-9-de-2020 ",18/06/2020,14h05
"Comunicado de Intenção de Registro de Preços (IRP) nº 08/2020","https://www.gov.br/compras/pt-br/acesso-a-informacao/noticias/comunicado-irp-8-de-2020 ",15/06/2020,16h19
"Abertura da Consulta Pública nº 4/2020 - Computação em nuvem","https://www.gov.br/compras/pt-br/acesso-a-informacao/noticias/cp04-2020-computacao-em-nuvem ",12/06/2020,08h35
"Empresários poderão parcelar multas aplicadas pelo governo","https://www.gov.br/compras/pt-br/acesso-a-informacao/noticias/empresarios-poderao-parcelar-multas-aplicadas-pelo-governo ",10/06/2020,09h20
"Segundo artigo da série ""Diálogos em Logística Pública""","https://www.gov.br/compras/pt-br/acesso-a-informacao/noticias/segundo-artigo-dpl ",08/06/2020,10h30
"Passa a vigorar a obrigatoriedade do uso do pregão eletrônico por Municípios com menos de 15 mil habitantes","https://www.gov.br/compras/pt-br/acesso-a-informacao/noticias/uso-obrigatorio-do-pregao-eletronico-para-municipios-com-menos-de-15mil-habitantes ",01/06/2020,13h54
